[
  {
    "name": "MakerKit",
    "slug": "makerkit",
    "website": "https://makerkit.dev/",
    "repository": "https://makerkit.dev/",
    "documentation": "https://makerkit.dev/docs/next-supabase-turbo/analytics",
    "frameworks": ["Next.js", "React Router", "Supabase"],
    "language": "TypeScript",
    "license": "Commercial",
    "commercial": true,
    "openSource": false,
    "active": true,
    "analyticsProviders": ["Google Analytics", "PostHog", "Umami", "Custom"],
    "analyticsArchitecture": "Provider-agnostic analytics service connected to typed application events.",
    "integrationMethod": "Native custom provider plus the official Zenovay tracker.",
    "paymentProviders": ["Stripe"],
    "targetAudience": ["SaaS founders", "agencies", "commercial builders"],
    "popularitySignals": { "checkedAt": "2026-07-18", "source": "https://makerkit.dev/", "note": "Established commercial SaaS kit with several maintained variants." },
    "lastChecked": "2026-07-18",
    "integrationStatus": "guide-only",
    "integrationPath": "boilerplates/makerkit",
    "priorityScore": 94,
    "priorityReason": "Excellent native provider abstraction, SaaS audience, application events, and Stripe relevance.",
    "evidence": ["https://makerkit.dev/docs/next-supabase-turbo/analytics", "https://makerkit.dev/docs/react-router-supabase-turbo/analytics/analytics-and-events"]
  },
  {
    "name": "supastarter",
    "slug": "supastarter",
    "website": "https://supastarter.dev/",
    "repository": "https://supastarter.dev/",
    "documentation": "https://supastarter.dev/docs/nextjs/analytics/overview",
    "frameworks": ["Next.js", "Nuxt", "Supabase"],
    "language": "TypeScript",
    "license": "Commercial",
    "commercial": true,
    "openSource": false,
    "active": true,
    "analyticsProviders": ["Google Analytics", "Mixpanel", "Pirsch", "Plausible", "Umami", "Vercel Analytics", "Vemetric", "PostHog", "Custom"],
    "analyticsArchitecture": "Generic analytics module with provider files and a shared script component.",
    "integrationMethod": "Custom provider file backed by @zenovay/tracker.",
    "paymentProviders": ["Stripe", "Lemon Squeezy"],
    "targetAudience": ["SaaS founders", "commercial builders"],
    "popularitySignals": { "checkedAt": "2026-07-18", "source": "https://supastarter.dev/", "note": "Commercial multi-framework starter with public provider documentation." },
    "lastChecked": "2026-07-18",
    "integrationStatus": "guide-only",
    "integrationPath": "boilerplates/supastarter",
    "priorityScore": 93,
    "priorityReason": "Broad documented provider menu and direct custom-provider extension point.",
    "evidence": ["https://supastarter.dev/docs/nextjs/analytics/overview"]
  },
  {
    "name": "TurboStarter",
    "slug": "turbostarter",
    "website": "https://www.turbostarter.dev/",
    "repository": "https://www.turbostarter.dev/",
    "documentation": "https://www.turbostarter.dev/docs/web/analytics/configuration",
    "frameworks": ["Next.js", "React Native", "Turborepo"],
    "language": "TypeScript",
    "license": "Commercial",
    "commercial": true,
    "openSource": false,
    "active": true,
    "analyticsProviders": ["Vercel Analytics", "Google Analytics", "Vemetric"],
    "analyticsArchitecture": "Client provider contract exposes Provider and track; a separate server strategy is documented.",
    "integrationMethod": "Client Zenovay provider; no server API is invented.",
    "paymentProviders": ["Stripe", "Lemon Squeezy"],
    "targetAudience": ["SaaS founders", "mobile builders", "commercial builders"],
    "popularitySignals": { "checkedAt": "2026-07-18", "source": "https://www.turbostarter.dev/", "note": "Commercial multi-platform kit with public integration contracts." },
    "lastChecked": "2026-07-18",
    "integrationStatus": "guide-only",
    "integrationPath": "boilerplates/turbostarter",
    "priorityScore": 91,
    "priorityReason": "A provider contract makes Zenovay feel native, with strong SaaS and billing relevance.",
    "evidence": ["https://www.turbostarter.dev/docs/web/analytics/configuration", "https://www.turbostarter.dev/docs/web/analytics/tracking/"]
  },
  {
    "name": "next-forge",
    "slug": "next-forge",
    "website": "https://www.next-forge.com/",
    "repository": "https://github.com/vercel/next-forge",
    "documentation": "https://github.com/vercel/next-forge/tree/main/packages/analytics",
    "frameworks": ["Next.js", "Turborepo"],
    "language": "TypeScript",
    "license": "MIT",
    "commercial": false,
    "openSource": true,
    "active": true,
    "analyticsProviders": ["Google Analytics", "Vercel Analytics", "PostHog"],
    "analyticsArchitecture": "Dedicated @repo/analytics workspace package with provider, client initialization, keys, and server exports.",
    "integrationMethod": "Add Zenovay to the existing analytics package and app instrumentation client.",
    "paymentProviders": ["Stripe"],
    "targetAudience": ["SaaS founders", "agencies", "Next.js teams"],
    "popularitySignals": { "githubStars": 7126, "checkedAt": "2026-07-18", "source": "https://github.com/vercel/next-forge" },
    "lastChecked": "2026-07-18",
    "integrationStatus": "verified",
    "integrationPath": "boilerplates/next-forge",
    "priorityScore": 90,
    "priorityReason": "High adoption, active maintenance, dedicated analytics package, Stripe, and competing providers.",
    "evidence": ["https://github.com/vercel/next-forge", "https://github.com/vercel/next-forge/blob/f189de79ceef7c1ef69f61f12e272f99b4cdb699/packages/analytics/provider.tsx", "https://github.com/vercel/next-forge/blob/f189de79ceef7c1ef69f61f12e272f99b4cdb699/packages/analytics/instrumentation-client.ts"]
  },
  {
    "name": "Pliny",
    "slug": "pliny",
    "website": "https://github.com/timlrx/pliny",
    "repository": "https://github.com/timlrx/pliny",
    "documentation": "https://github.com/timlrx/pliny/tree/main/packages/pliny/src/analytics",
    "frameworks": ["Next.js", "React"],
    "language": "TypeScript",
    "license": "MIT",
    "commercial": false,
    "openSource": true,
    "active": true,
    "analyticsProviders": ["Google Analytics", "Plausible", "Simple Analytics", "Umami", "PostHog", "Microsoft Clarity"],
    "analyticsArchitecture": "Published provider components selected through AnalyticsConfig.",
    "integrationMethod": "Add a Zenovay provider component and config entry.",
    "paymentProviders": [],
    "targetAudience": ["template maintainers", "publishers", "Next.js developers"],
    "popularitySignals": { "githubStars": 341, "checkedAt": "2026-07-18", "source": "https://github.com/timlrx/pliny" },
    "lastChecked": "2026-07-18",
    "integrationStatus": "verified",
    "integrationPath": "boilerplates/pliny",
    "priorityScore": 89,
    "priorityReason": "One provider contribution can unlock multiple Pliny-based templates including the high-adoption starter blog.",
    "evidence": ["https://github.com/timlrx/pliny/blob/f6302e3e0723888accb2d8a02068d6bc5c1377b9/packages/pliny/src/analytics/index.tsx", "https://github.com/timlrx/pliny/tree/main/packages/pliny/src/analytics"]
  },
  {
    "name": "Tailwind Next.js Starter Blog",
    "slug": "tailwind-nextjs-starter-blog",
    "website": "https://tailwind-nextjs-starter-blog.vercel.app/",
    "repository": "https://github.com/timlrx/tailwind-nextjs-starter-blog",
    "documentation": "https://tailwind-nextjs-starter-blog.vercel.app/blog/release-of-tailwind-nextjs-starter-blog-v2.0",
    "frameworks": ["Next.js", "Pliny"],
    "language": "TypeScript",
    "license": "MIT",
    "commercial": false,
    "openSource": true,
    "active": true,
    "analyticsProviders": ["Google Analytics", "Plausible", "Simple Analytics", "Umami", "PostHog"],
    "analyticsArchitecture": "siteMetadata selects a Pliny analytics provider rendered by the root layout.",
    "integrationMethod": "Enable the Pliny Zenovay provider in siteMetadata.",
    "paymentProviders": [],
    "targetAudience": ["developers", "publishers", "template users"],
    "popularitySignals": { "githubStars": 10515, "checkedAt": "2026-07-18", "source": "https://github.com/timlrx/tailwind-nextjs-starter-blog" },
    "lastChecked": "2026-07-18",
    "integrationStatus": "community",
    "integrationPath": "boilerplates/tailwind-nextjs-starter-blog",
    "priorityScore": 88,
    "priorityReason": "Large adoption and an existing multi-provider configuration inherited from Pliny.",
    "evidence": ["https://github.com/timlrx/tailwind-nextjs-starter-blog", "https://github.com/timlrx/tailwind-nextjs-starter-blog/blob/b45bef66b40c63b6f57c15ee8cd090682238df4c/data/siteMetadata.js"]
  },
  {
    "name": "Open SaaS",
    "slug": "open-saas",
    "website": "https://opensaas.sh/",
    "repository": "https://github.com/wasp-lang/open-saas",
    "documentation": "https://opensaas.sh/docs/guides/analytics/",
    "frameworks": ["Wasp", "React", "Node.js"],
    "language": "TypeScript",
    "license": "MIT",
    "commercial": false,
    "openSource": true,
    "active": true,
    "analyticsProviders": ["Google Analytics", "Plausible"],
    "analyticsArchitecture": "Tracker script in Wasp app head plus server-side reporting helpers for the admin dashboard.",
    "integrationMethod": "Use Zenovay for browser analytics; retain or separately adapt admin reporting.",
    "paymentProviders": ["Stripe", "Polar"],
    "targetAudience": ["SaaS founders", "indie hackers", "AI builders"],
    "popularitySignals": { "githubStars": 14941, "checkedAt": "2026-07-18", "source": "https://github.com/wasp-lang/open-saas" },
    "lastChecked": "2026-07-18",
    "integrationStatus": "community",
    "integrationPath": "boilerplates/open-saas",
    "priorityScore": 87,
    "priorityReason": "Very high adoption, direct SaaS audience, payment integrations, and documented analytics setup.",
    "evidence": ["https://github.com/wasp-lang/open-saas", "https://opensaas.sh/docs/guides/analytics/"]
  },
  {